{
  "$schema": "http://json-schema.org/draft-07/schema#",
  "definitions": {
    "Feature": {
      "properties": {
        "enabled": {
          "type": "boolean"
        },
        "params": {
          "type": "object"
        },
        "children": {
          "type": "object",
          "additionalProperties": {
            "$ref": "#/definitions/Feature"
          }
        }
      },
      "required": ["enabled", "params"],
      "type": "object"
    },
    "VersionConfig": {
      "properties": {
        "version": {
          "type": "string",
          "description": "版本标识符"
        },
        "name": {
          "type": "string",
          "description": "版本名称"
        },
        "description": {
          "type": "string",
          "description": "版本描述"
        },
        "features": {
          "type": "object",
          "additionalProperties": {
            "$ref": "#/definitions/Feature"
          }
        }
      },
      "required": ["version", "name", "description", "features"],
      "type": "object"
    }
  },
  "$ref": "#/definitions/VersionConfig"
}
